{
    "$schema": "https://json-schema.org/draft/2020-12/schema",
    "title": "Polaris Code Intelligence Provider descriptor",
    "type": "object",
    "required": [
        "provider_version",
        "provider_id",
        "display_name",
        "transport",
        "file_extensions",
        "operations"
    ],
    "additionalProperties": false,
    "properties": {
        "provider_version": {
            "const": 1
        },
        "provider_id": {
            "type": "string",
            "pattern": "^[a-z][a-z0-9-]*$"
        },
        "display_name": {
            "type": "string",
            "minLength": 1
        },
        "transport": {
            "const": "mcp"
        },
        "file_extensions": {
            "type": "array",
            "minItems": 1,
            "uniqueItems": true,
            "items": {
                "type": "string",
                "pattern": "^\\.[A-Za-z0-9][A-Za-z0-9+_-]*$"
            }
        },
        "operations": {
            "type": "object",
            "additionalProperties": false,
            "properties": {
                "symbol_search": {"type": "string", "pattern": "^[A-Za-z][A-Za-z0-9_.:-]*$"},
                "context": {"type": "string", "pattern": "^[A-Za-z][A-Za-z0-9_.:-]*$"},
                "dependencies": {"type": "string", "pattern": "^[A-Za-z][A-Za-z0-9_.:-]*$"},
                "call_graph": {"type": "string", "pattern": "^[A-Za-z][A-Za-z0-9_.:-]*$"},
                "impact": {"type": "string", "pattern": "^[A-Za-z][A-Za-z0-9_.:-]*$"},
                "review_context": {"type": "string", "pattern": "^[A-Za-z][A-Za-z0-9_.:-]*$"},
                "refresh_files": {"type": "string", "pattern": "^[A-Za-z][A-Za-z0-9_.:-]*$"},
                "refresh_workspace": {"type": "string", "pattern": "^[A-Za-z][A-Za-z0-9_.:-]*$"}
            }
        }
    }
}
